voice_resource_id,voice_asr_text,true_label,pred_label,true_label_name,pred_label_name,pred_reason,error_type
Uo0_bouLmdY.aac,都想盖绿板，刚好下面也麻烦哦，手机钞票，奔驰天涯，还有大天龙。,1,0,搞笑/玩梗,非搞笑/玩梗,文本混乱似ASR错误，无明确搞笑结构，按全局铁律判0。,误判
AjpO4rOV2Tc.aac,来来来来，卖三明治，卖三明治。,1,0,搞笑/玩梗,非搞笑/玩梗,简单叫卖重复，无搞笑结构，Step9判0。,误判
_f6cHoag3tg.aac,卖神秘制的，非常好吃。,1,0,搞笑/玩梗,非搞笑/玩梗,简单叫卖，无搞笑结构，Step9判0。,误判
6DzW9xQc8zc.aac,什么叫做5200，经常转一次比一次突破。这还是中国话吗？明明每个字我都认识组合在一起，我怎么就不认识了。,1,0,搞笑/玩梗,非搞笑/玩梗,表达困惑吐槽，语气夸张但无具体搞笑结构，Step9判0。,误判
fBDDoTeGvLQ.aac,你是我。,1,0,搞笑/玩梗,非搞笑/玩梗,极短无意义，无搞笑意图，Step9判0。,误判
DB_V2wjsRKQ.aac,三明治，三明治，我在买新鲜的三明治。,1,0,搞笑/玩梗,非搞笑/玩梗,单纯陈述购买行为，无搞笑意图。,误判
8jb_NAonngk.aac,三明治，三明治卖，三明治，三明治。,1,0,搞笑/玩梗,非搞笑/玩梗,重复叫卖，无搞笑结构。,误判
CHlhmklfpGo.aac,你怎么忍心怪你对我太毒逗。无时无刻就像一把无法停止的乌云钩。扛住了柴米油盐的麻烦，扛住了朋友聚会的焦。,0,1,非搞笑/玩梗,搞笑/玩梗,Step2第6条，恶搞改编歌词（毒逗、乌云钩等荒诞词），故意制造笑点。,误判
7nN60fyeUAU.aac,哎呀，嘟嘟嘟嘟嘟嘟嘟嘟嘟嘟嘟嘟。儿子，儿子，儿子奶奶奶奶奶奶奶奶奶奶。干嘛呢？,1,0,搞笑/玩梗,非搞笑/玩梗,无明确搞笑结构，疑似乱语或ASR错误，边界判0。,误判
xtMoh9kiRwQ.aac,我去，竟然能发语音了。,0,1,非搞笑/玩梗,搞笑/玩梗,Step2第10条，押韵顺口溜带荒诞场景（奥特曼慢飞），属于玩梗。,误判
7m4utLn0EY0.aac,奥特曼飞得慢，飞到凌晨三点半。,1,0,搞笑/玩梗,非搞笑/玩梗,正常叫卖广告，无搞笑结构。,误判
lsuzExbHzig.aac,卖三明治嘞，卖三明治嘞，走过路过不要错过，看看我们家最近新鲜的三明治。都是自己纯手工打造。,1,0,搞笑/玩梗,非搞笑/玩梗,ASR错误或无意义，无搞笑结构。,误判
GvYkDOcmLSI.aac,sity spection。,1,0,搞笑/玩梗,非搞笑/玩梗,先描述后笑声，但描述无明确反转/荒诞结构，笑声为附带情绪，边界判0。,误判
mSS-hFtJBB4.aac,棉袄叔叔在练步机。哈哈哈。,1,0,搞笑/玩梗,非搞笑/玩梗,叫卖为主，笑声依附于卖货核心意图，非主动制造笑点（Step7）。,误判
8pryz94qCPM.aac,卖扇贝吃喽，卖扇贝吃喽，看看，哈哈哈哈哈，卖扇贝吃喽。,1,异常,搞笑/玩梗,解析错误,返回结果数量不足（期望20条，实际19条）,API异常
9-CVoGqwDlc.aac,呃。啊，是关中王来了。点开这颗星，点亮这颗星。哥哥你在哪里？,1,0,搞笑/玩梗,非搞笑/玩梗,直播互动话术，无明确搞笑结构，拿不准按全局铁律判0。,误判
89bFcIPWNho.aac,哔哔喇叭，我的刀盾。,1,0,搞笑/玩梗,非搞笑/玩梗,游戏术语或短句，无搞笑结构，Step9判0。,误判
cpqnl5U8wYU.aac,这歌变神奇。发音还在唱歌。我听着语音缝补出来。,1,0,搞笑/玩梗,非搞笑/玩梗,无搞笑结构，仅为描述性语句，未命中任何判1规则。,误判
cgwDTpD3i1A.aac,当当当当当。,1,0,搞笑/玩梗,非搞笑/玩梗,纯拟声字符，无独立语义，Step5判0。,误判
FBwkSG38p4s.aac,来三明治，三明治好吃，要钱不好吃也要钱来。,1,0,搞笑/玩梗,非搞笑/玩梗,陈述性内容，无明显搞笑结构，拿不准按全局铁律判0。,误判
hZYCXX4-PJw.aac,我真的好崩溃啊。你发语音就唱歌，我是真的没招惹。,1,0,搞笑/玩梗,非搞笑/玩梗,抱怨吐槽，无搞笑结构，核心意图是表达不满。,误判
Nd0yxPcUFGE.aac,哈喽everybody。sorry，我不喜欢女孩，sorry我不会哄男孩。,1,0,搞笑/玩梗,非搞笑/玩梗,陈述性内容，无明显搞笑结构，拿不准按全局铁律判0。,误判
k39sNROxshM.aac,不是干嘛啊，播真的没招了。,1,0,搞笑/玩梗,非搞笑/玩梗,抱怨/无奈语气，无具体搞笑结构，不命中规则。,误判
_vfsP4u1NEE.aac,猜名字，猜名字看一下吧。有点害羞哦，三明治。三明治在睡觉，周末有教室。想买的话可。先把他们。芭蕉香，OK。,1,0,搞笑/玩梗,非搞笑/玩梗,内容杂乱无章，疑似ASR错误或胡言，无明确搞笑结构。,误判
2aPG0zZ8h9g.aac,叫哥哥。,1,0,搞笑/玩梗,非搞笑/玩梗,极短指令，无搞笑意图。,误判
RAyAYUOXo3k.aac,我非要去下载玩吃鸡。,1,0,搞笑/玩梗,非搞笑/玩梗,表达意愿，无搞笑结构。,误判
3Y9oElNxNOg.aac,特别神奇，发育音还在唱歌。我听着语音蹦不出了啊。,1,0,搞笑/玩梗,非搞笑/玩梗,无明确搞笑结构，'蹦不出了'非标准笑声词，核心为叙述吐槽，Step9兜底判0。,误判
BDx3NJS_5p8.aac,小哥哥。太小了叫叔叔，太老了，你应该怎么叫我的。,1,0,搞笑/玩梗,非搞笑/玩梗,调侃称呼但无明确搞笑结构，核心为询问，Step9兜底判0。,误判
RaJlAec9uVM.aac,泪水打湿养浴吧，又麻又辣又想她。,1,0,搞笑/玩梗,非搞笑/玩梗,可能为网络梗但语义模糊，ASR可能错误，边界内容按全局铁律判0。,误判
g2anZjJ8Ds8.aac,别闹叔叔再连夫妻。嗯嗯。,1,0,搞笑/玩梗,非搞笑/玩梗,语义不连贯，可能ASR错误，无明确搞笑结构，Step9判0。,误判
e3N1FYn5My8.aac,真是服了这个KK键盘了，什么恶臭的语音，一说话就开始唱歌。搞得我们同学他们都嫌弃了，好吧，家人们。,1,0,搞笑/玩梗,非搞笑/玩梗,核心为抱怨吐槽，无主动制造笑点的结构，Step9判0。,误判
tpyHh7tAvSE.aac,三明治。,1,0,搞笑/玩梗,非搞笑/玩梗,极短无特征，Step9判0。,误判
XgYO7x1Hf_g.aac,三明治，三明治，新鲜的三明治嘞。,1,0,搞笑/玩梗,非搞笑/玩梗,像是叫卖语，无搞笑结构，Step9判0。,误判
DrlF0LQUaEk.aac,叫哥哥太小了，叫叔叔太老了，叫妈妈性格不对。那我想想应该叫什么呢？,1,0,搞笑/玩梗,非搞笑/玩梗,正常思考称呼，无明显反转或荒诞，边界判0。,误判
On8IRuSqYgg.aac,叫哥哥太小了。叫叔叔再唠了。叫妈妈性别不对。到底该叫什么呢？,1,0,搞笑/玩梗,非搞笑/玩梗,与样本6类似，无明确搞笑结构，边界判0。,误判
Hft1Wcl2hUQ.aac,嗯。哭完了吗？哭完挂了。,1,0,搞笑/玩梗,非搞笑/玩梗,正常对话语气，无搞笑意图，Step9判0。,误判
KbdKmoWmk4o.aac,啊去。,1,0,搞笑/玩梗,非搞笑/玩梗,极短无特征，Step9判0。,误判
yRIIdlBvFuE.aac,啊啊。哈哈哈哈。哎。哈哈哈。,1,0,搞笑/玩梗,非搞笑/玩梗,纯拟声笑声字符，无独立语义，Step5判0。,误判
M6qHVQUPsxM.aac,向上向上，向上，向上向上。挣钱。,1,0,搞笑/玩梗,非搞笑/玩梗,重复口号，无搞笑结构，Step9判0。,误判
_NXZPuYEpPI.aac,爱在唱歌。我听着语音封不住了啦。,1,0,搞笑/玩梗,非搞笑/玩梗,“封不住了”疑似ASR错误，非标准笑声词，无搞笑结构，边界判0。,误判
mxHpBDoHKxQ.aac,啊。,1,0,搞笑/玩梗,非搞笑/玩梗,极短感叹，无搞笑特征，Step9判0。,误判
bihK2JCsh8I.aac,我只是摔倒了，又不是摔死了，你凭什么觉得。我爬不起来了呢。,1,0,搞笑/玩梗,非搞笑/玩梗,无明确搞笑结构，语气像反驳而非自嘲反转，边界内容判0（全局铁律）。,误判
_R7zmcVa8Dw.aac,向上向上，向上向上向前是萝莉音，湖北歌就是串通。,1,0,搞笑/玩梗,非搞笑/玩梗,内容混乱，疑似ASR错误或唱歌，无搞笑意图，判0。,误判
urY4wyV80hY.aac,猪猪。我要换奶片喽。,1,0,搞笑/玩梗,非搞笑/玩梗,普通叙述，无搞笑结构，判0。,误判
_nWzwlmNny8.aac,6666。,1,0,搞笑/玩梗,非搞笑/玩梗,纯数字，无搞笑结构，判0。,误判
nqOgtgFzzXk.aac,啊啊。OK，可离合呀，好棒。,1,0,搞笑/玩梗,非搞笑/玩梗,简单感叹，无搞笑结构，判0。,误判
jPAboLUxsOk.aac,啊，不出。哇哦哦哦。,1,0,搞笑/玩梗,非搞笑/玩梗,无意义感叹，无搞笑意图，判0。,误判
T7_9EnjS-gc.aac,中奖概率倍儿高，奖品野马跟儿好。嗯哎，不会唱了。,1,0,搞笑/玩梗,非搞笑/玩梗,前半句像广告顺口溜，后半句说不会唱，无明确搞笑结构，边界判0。,误判
t_kfQBRYYLs.aac,啊。,1,0,搞笑/玩梗,非搞笑/玩梗,单字无意义，无搞笑结构，判0。,误判
kvOzcj0z_bk.aac,我要烟牌牌没有问题，我给我踩皮鞋。,1,0,搞笑/玩梗,非搞笑/玩梗,内容模糊，无明确搞笑结构，判0。,误判
boUawH4KhlI.aac,别闹了。世人难辨不清。,1,0,搞笑/玩梗,非搞笑/玩梗,前半句像调侃但后半句无明确搞笑结构，Step9判0。,误判
Tf3vo8TsD88.aac,向上向上，向上向上向上向前是俄语音。,1,0,搞笑/玩梗,非搞笑/玩梗,无搞笑结构，疑似指令或描述，Step9判0。,误判
JGpduCwCXc4.aac,在现在特别的日子里，送给你们一首非常特别的歌曲。特别的爱给特别的你来享受一下拖拉机的脸，带给你法拉利的声音，一起来嗨。特别的爱给特别的你，我的寂寞逃不过你的眼睛，特别的爱。特别的你，你让我越来越不相信自己。,0,1,非搞笑/玩梗,搞笑/玩梗,恶搞改编歌词，将经典歌曲与拖拉机/法拉利反差结合，符合Step2第6条。,误判
pR7UHrjc-2E.aac,叫哥哥还是叫老公小调皮，哈哈哈哈哈哈哈。,0,1,非搞笑/玩梗,搞笑/玩梗,调侃称呼+笑声词，核心意图是逗乐，符合Step1（笑声核心意图词）及Step2第9条。,误判
ID-7OHrjbkg.aac,我真的着了，有没有人帮帮我真的管不了了。,1,0,搞笑/玩梗,非搞笑/玩梗,表达崩溃情绪，无搞笑结构，Step9判0。,误判
9yVYMCaIAnc.aac,小哥哥太小了。叫叔叔看来了，你妈妈性格不对，你想想。你应该相信吧。,1,0,搞笑/玩梗,非搞笑/玩梗,表述混乱，意图不清晰，边界内容按全局铁律判0。,误判
Z-eDel2fa_g.aac,啊，这可别生气。把语音还在唱歌。我听着语音绷不住的爱。,1,0,搞笑/玩梗,非搞笑/玩梗,出现“绷不住”但表述不完整，无具体搞笑内容支撑，边界判0。,误判
tBSLrb3_lTY.aac,向下向下，向下，向下向后上点儿。,1,0,搞笑/玩梗,非搞笑/玩梗,指令性内容，无搞笑结构，Step9判0。,误判
EbLbdphagVE.aac,我真的好崩溃啊。你发语音就唱歌，我是真的没招惹。,1,0,搞笑/玩梗,非搞笑/玩梗,抱怨吐槽，无搞笑结构，Step9判0。,误判
wQP8yhbMpO8.aac,呵，好呵，好，呵呵呵。,1,0,搞笑/玩梗,非搞笑/玩梗,纯拟声笑声字符，无独立语义，Step5排除判0。,误判
PEFk2hJhQQE.aac,新疆的猫叫彬彬，他不来不信你听。咪咪咪咪咪咪。调皮给他妈喊过来你听啊。回来啦。,1,0,搞笑/玩梗,非搞笑/玩梗,描述逗猫场景，无明确搞笑结构，Step9判0。,误判
xfh2e68kL_k.aac,小萝卜。,1,0,搞笑/玩梗,非搞笑/玩梗,极短无特征，Step9兜底判0。,误判
yCdBTl9XNeA.aac,我要烟牌牌没有问题给我擦皮鞋。,1,0,搞笑/玩梗,非搞笑/玩梗,语句不通顺，可能ASR错误，无搞笑结构。,误判
g1Lv3h8CGp0.aac,我听见你心中那动人的天籁，就忽如一夜春风袭来，满面桃花开，我忍不住去踩。我忍不住去摘我敞开胸怀，为你等待你抬抬。,1,0,搞笑/玩梗,非搞笑/玩梗,可能为恶搞改编，但更像ASR误识别，边界按全局铁律判0。,误判
J5hInoM1Qzc.aac,一开始我也以为他们只是玩个，然后就买了个变声器，结果现在改不回了。,1,0,搞笑/玩梗,非搞笑/玩梗,叙述经历，无主动制造笑点结构。,误判
RAW-bTxAYyk.aac,嗯嗯。,1,0,搞笑/玩梗,非搞笑/玩梗,极短回应，无特征。,误判
wc99dTifm6o.aac,啊啊。big。,1,0,搞笑/玩梗,非搞笑/玩梗,无意义，无搞笑结构。,误判
mmlLkpLeR98.aac,不能啊。啊。嗯，不能拿。,1,0,搞笑/玩梗,非搞笑/玩梗,普通回应，无搞笑意图。,误判
mVCUcqub5x0.aac,三明治，三明治，三明治。今天新的三明治，好吃又好吃，特别好吃，三明治啦。嗨。,1,0,搞笑/玩梗,非搞笑/玩梗,类似广告/自夸，无搞笑结构。,误判
Zw_RxgS0OQQ.aac,什么东西拿回读英语嘞，能开玩笑嘞。city sfection,1,0,搞笑/玩梗,非搞笑/玩梗,语气调侃但无明确搞笑结构，边界判0。,误判
gH6Rw9pr7Pk.aac,别闹，我在玩和平精英。,1,0,搞笑/玩梗,非搞笑/玩梗,普通回应，无搞笑结构。,误判
MGF9FVr9Sqs.aac,怎么都开始挑战这个熊东西了。有什么好挑战的，我靠了兄弟set is vection。,1,0,搞笑/玩梗,非搞笑/玩梗,吐槽语气，无明确搞笑结构，ASR部分错误。,误判
EqXGPuULt68.aac,妈妈31岁。11岁又健康的31岁谁要买给我直播间拉倒。,1,0,搞笑/玩梗,非搞笑/玩梗,内容混乱，可能ASR错误，无明确搞笑结构，Step9判0。,误判
iENRM428CCw.aac,city sfiction,1,0,搞笑/玩梗,非搞笑/玩梗,极短无上下文，无搞笑特征，Step9判0。,误判
_SEXkv3BAR0.aac,中奖概率倍儿高，奖品也码倍儿好，手机钞票本身今天还有大奖了。,1,0,搞笑/玩梗,非搞笑/玩梗,类似广告宣传，无明确搞笑结构，拿不准判0，Step9。,误判
0WfrHFdnXdY.aac,啊。啊啊。啊啊嘿。啊哈嘿。啊嘿。诶诶诶。你人节快乐。一道道的沟沟。抖音道道亮。,1,0,搞笑/玩梗,非搞笑/玩梗,拟声+混乱歌词，无搞笑结构，Step9判0。,误判
3rdkZRqs3yI.aac,啊啊啊。啊。,1,0,搞笑/玩梗,非搞笑/玩梗,纯拟声，无语义，Step5排除，判0。,误判
S56THLPagNw.aac,哈哈哈哈。,1,0,搞笑/玩梗,非搞笑/玩梗,纯笑声字符，无搞笑意图，Step5判0。,误判
4mHqKHKmQP4.aac,向下向下，向下，向下向下向前。,1,0,搞笑/玩梗,非搞笑/玩梗,重复无意义的指令或ASR错误，无搞笑意图。Step9判0。,误判
Rx8xhqNaPF0.aac,浑沌眯一捂。鱼条一根。当你把这个倒头鱼条往脚米里面一泼。秦茂明渡过前后。,1,0,搞笑/玩梗,非搞笑/玩梗,内容混乱，疑似ASR错误，无搞笑结构。Step9判0。,误判
kuCSzqcbgpA.aac,我现在用最简单最直白，最不绕弯子的话告诉你我没绷住。,1,0,搞笑/玩梗,非搞笑/玩梗,"仅出现""没绷住""但单独成句，无具体内容支撑逗乐。Step1判0。",误判
jVEWUkQ_AVg.aac,为什么我下载了这个现在说话都是唱歌的，我真的绷不住了，我卸载了都还搁那唱。,0,1,非搞笑/玩梗,搞笑/玩梗,"Step1命中：""绷不住了""配合具体荒诞描述（卸载后还在唱），主动制造笑点。",误判
rOoKUVoKUg4.aac,你是绝对温满村。你以为你保护的那些村货。我发现不了吗？看到我。,1,0,搞笑/玩梗,非搞笑/玩梗,疑似威胁或中二台词，无搞笑意图。Step9判0。,误判
GpYgsg-zXhE.aac,再见吧撒，再见吧撒，再见吧撒，再见吧撒，再见吧撒。带紧摸杀仙女摸手这么久了，仙女点位不对，姐妹摸手摸发。,1,0,搞笑/玩梗,非搞笑/玩梗,重复无意义，疑似ASR错误，无搞笑结构。Step9判0。,误判
dTSTYFD7Cdo.aac,姐姐于静香，哪有你的余静香鬼鬼鬼鬼鬼鬼鬼鬼鬼鬼鬼鬼鬼鬼鬼鬼鬼鬼鬼鬼亲吻亲吻，亲吻亲吻。,1,0,搞笑/玩梗,非搞笑/玩梗,ASR识别错误/重复字符，无明确搞笑意图，不满足SOP任何判1条件，兜底判0（Step9）。,误判
q1tgXl8Yg7E.aac,鹅鹅鹅。,1,0,搞笑/玩梗,非搞笑/玩梗,简短拟声，无独立语义，无搞笑结构，按Step9兜底判0。,误判
BzOScGQuv7Y.aac,炸一炸摇一摇，校长看到。,1,0,搞笑/玩梗,非搞笑/玩梗,文本简短，语境不明，无法确认是主动制造笑点，边界情况按全局铁律判0（Step9）。,误判
_rYpvT-_zCA.aac,我也会飞。哎。,1,0,搞笑/玩梗,非搞笑/玩梗,简短无上下文，无法判断是玩梗或搞笑，按Step9兜底判0。,误判
5uKuX8BYsdA.aac,哎。,1,0,搞笑/玩梗,非搞笑/玩梗,单字无语义，无搞笑意图，兜底判0（Step9）。,误判
fJoBIiU2g1g.aac,sless fixtion。,1,0,搞笑/玩梗,非搞笑/玩梗,ASR识别错误/无意义，无搞笑意图，兜底判0（Step9）。,误判
SL_Kgd1uyU0.aac,这是是我的的。你是该。,1,0,搞笑/玩梗,非搞笑/玩梗,文本极短且语义不完整，疑似ASR错误，无搞笑意图（Step9）,误判
c5yLFxeDOyA.aac,艾玛这个我也会呀，相上相上，相上向前是萝莉音，湖北哥就是伤头。,1,0,搞笑/玩梗,非搞笑/玩梗,语义混乱，无明确搞笑结构，可能ASR错误，非主动制造笑点（Step9）,误判
xODzBC2Hgm0.aac,明天新赛季了，地铁破产，认准少儿电竞。,0,1,非搞笑/玩梗,搞笑/玩梗,命中Step2第2条：调侃式广告，用“地铁破产”“少儿电竞”制造反差笑点，主动逗乐,误判
E4Gd7VNInTI.aac,笨妈妈。,1,0,搞笑/玩梗,非搞笑/玩梗,极短无明显特征，无法判断为玩梗（Step9兜底判0）,误判
YVLFotCWrRg.aac,哈哈哈哈哈哈。哈哈哈哈哈。我不行了。,1,0,搞笑/玩梗,非搞笑/玩梗,纯拟声笑声加简短回应，无独立语义和主动逗乐内容（Step5判0）,误判
a0kcMt2bDZQ.aac,大家好，我是面糖。,1,0,搞笑/玩梗,非搞笑/玩梗,简单自我介绍，无搞笑结构（Step9）,误判
O5Ks6pAYJKE.aac,胡萝卜。,1,0,搞笑/玩梗,非搞笑/玩梗,单个词，无上下文，无法判定为玩梗（Step9兜底判0）,误判
uWAzvgqUoNY.aac,我只是摔倒了。又不是摔死了。你凭什么觉得我爬不起来。,1,0,搞笑/玩梗,非搞笑/玩梗,表达情绪反驳，虽有夸张但无主动制造笑点的结构，核心是抱怨。,误判
Y89xUwyDUzc.aac,a lot。我是青蛇。,1,0,搞笑/玩梗,非搞笑/玩梗,简短无上下文，无法判定为玩梗，归为普通表述。,误判
d0kq-VCKm-A.aac,浇面油油条一个。当你把这个刀面油条往烫去一泡。咦。这个味道你拿三百六一个狙把子都不丢。,1,0,搞笑/玩梗,非搞笑/玩梗,描述做饭过程，最后一句方言表达，无搞笑反转结构，核心是叙述。,误判
XsjSZqENbis.aac,巅峰的三个大佬，叶远龙已经死去，秋风正跪在地上，我有雨乘飞依然站着。秋风的这一跪代表着羽成飞的时代，终于来到职业是北园，是城南地区内最乱的学校，从未有任何一人能真正的把职院的势力统一。可是今天羽城非所。,1,0,搞笑/玩梗,非搞笑/玩梗,小说式剧情叙述，无笑声词、无搞笑结构，核心是讲述。,误判
L7Cl0AGB3Lw.aac,新疆猫叫咪咪，他不来。你听咪咪咪咪咪。叫死皮克，马上过来，哎贴。speak speak。来撕这个，来跳个舞，撕开撕开撕开撕开撕开撕开。啊。,1,0,搞笑/玩梗,非搞笑/玩梗,模仿猫叫和逗猫场景，核心是互动叙述，无主动制造笑点的结构。,误判
ZglP2V63tbw.aac,别闹叔叔会飞。不浪不浪，不浪，不浪不浪。,1,0,搞笑/玩梗,非搞笑/玩梗,简短，像逗小孩的话，无明确搞笑结构，无法断定是主动制造笑点。,误判
HNFn25ZHSdk.aac,啊。求求求你。,1,0,搞笑/玩梗,非搞笑/玩梗,简短哀求，无搞笑意图。,误判
ehybWWEKCY4.aac,and miss video。i would pery god，one hundred yourselfing dollars，but i have no money and i have an the part them back when like you one days。which my pear god is a very angry so he will cave tasing to come me。but if i defide and dragon i want have to pay bad this a hundred sousand dollars。geven dame enjoy the video clubi love you money。i love you me love you me。好了，皮儿大的要追上赖赖，我们快逃逸。尴尬come on on with me oh my god oh no别要开挂了，no。螃蟹路飞天大了，你完蛋啦。,0,1,非搞笑/玩梗,搞笑/玩梗,Step2第3条：正常叙述+荒诞反转（中英混杂、胡言乱语、螃蟹飞天），明显主动制造笑点,误判
8QcSorElPxo.aac,放屁，我这个不是真的吗，我是杰瑞密瓦哥，我一生都在乱写。,0,1,非搞笑/玩梗,搞笑/玩梗,Step2第1条自嘲式反转：自称杰瑞密瓦哥并说一生乱写，调侃自己,误判
dIWQR6uDzS4.aac,不再依赖哥哥孙长大吗？可没用。哥希望你能一直也爱我。,1,0,搞笑/玩梗,非搞笑/玩梗,歌词/情感表达，无搞笑结构（Step9兜底判0）,误判
FP0Bm8FqK6g.aac,泪水打湿数据线。一边流泪一边垫了擦头发。,1,0,搞笑/玩梗,非搞笑/玩梗,描述荒诞但可能为真实叙述，边界内容按全局铁律判0,误判
qQ7Ik_sFoWA.aac,我九块九买的变声器好听吗？,1,0,搞笑/玩梗,非搞笑/玩梗,自嘲式调侃但结构不明确，边界内容按全局铁律判0,误判
tkT4fF7C5k4.aac,来个家伙，我是面瘫。,1,0,搞笑/玩梗,非搞笑/玩梗,无明确搞笑结构，可能为自嘲但边界，按全局铁律判0,误判
iaiJn83qvJE.aac,say disfection。,1,0,搞笑/玩梗,非搞笑/玩梗,ASR文本无意义，无搞笑结构，Step9兜底判0。,误判
HrR6HmmZmnk.aac,周娘给你分儿个枪，匹马奔儿啊，手机上不了奔驰，今天还有那些拿。,1,0,搞笑/玩梗,非搞笑/玩梗,语义混乱，疑似ASR错误，无明确搞笑结构，Step9判0。,误判
mQokJ4Qtqtg.aac,奥特曼就奥特曼变身，奥特曼去挣100万。,1,0,搞笑/玩梗,非搞笑/玩梗,内容荒诞但可能为ASR错误或随意说，边界内容按全局铁律判0。,误判
7pKY7Ifz-qo.aac,让小伙子看到你在耍我的卡路里，在耍我的卡路里。嘿嘿，这是我不离的要求，我这一辈子都没结果。,1,0,搞笑/玩梗,非搞笑/玩梗,有笑声词但语义不通，疑似ASR错误，无明确搞笑结构，Step9判0。,误判
-FVrKFRZ51M.aac,泪水打湿小天才发誓从此不相爱。,1,0,搞笑/玩梗,非搞笑/玩梗,伤感风格，无反转或搞笑结构，Step9判0。,误判
xPwRlXWUTmg.aac,白娘娘。,1,0,搞笑/玩梗,非搞笑/玩梗,简单称呼，无搞笑结构，Step9判0。,误判
HH0PnHcI5_w.aac,特别的爱给特别的你。,1,0,搞笑/玩梗,非搞笑/玩梗,歌词引用，无搞笑意图，Step9判0。,误判
woeYM7ged0Q.aac,挣百万，挣百万，挣到百万就亏钱。,1,0,搞笑/玩梗,非搞笑/玩梗,简短吐槽，无明显搞笑结构，边界情况按全局铁律判0。,误判
N2C930IcF9o.aac,想要问问你敢不敢。像你傻子。,0,1,非搞笑/玩梗,搞笑/玩梗,正常歌词开头接荒诞续写“像你傻子”，符合Step2第3条固定梗句式+荒诞反转，且非识别错误。,误判
AMTXknhM8lo.aac,各位诸天的游子系统已经发放。请查收。,1,0,搞笑/玩梗,非搞笑/玩梗,普通通知语气，无搞笑结构或意图（Step9兜底）,误判
J-WwgFY7Xzk.aac,这歌变声器发语音还在唱歌，我听着语音绷不住了。,0,1,非搞笑/玩梗,搞笑/玩梗,出现“绷不住了”核心笑声词，且有具体内容支撑（变声器唱歌），命中Step1,误判
5OuMQRjFgGY.aac,不再依赖姐姐算长大吗？,1,0,搞笑/玩梗,非搞笑/玩梗,普通疑问句，无搞笑结构（Step9兜底）,误判
u5Mi8lltbYs.aac,朱迪为什么我接不了电话呀，朱迪，哎，急死我了，哎朱迪，朱迪，我接不了电话呀，朱迪。急死我了，哎呀哎呀。,1,0,搞笑/玩梗,非搞笑/玩梗,重复抱怨，未引用具体梗或台词，无搞笑结构（Step2第11条不适用）,误判
MaHBDHrllAc.aac,呵呵呵呵呵呵呵呵呵呵呵呵呵呵呵呵呵呵呀呵呀。,1,0,搞笑/玩梗,非搞笑/玩梗,纯拟声笑声字符，无独立语义，判为简短回应（Step5）,误判
5gflbkC47nk.aac,恰。踩着我脚啦。,1,0,搞笑/玩梗,非搞笑/玩梗,简短陈述，可能带抱怨，无搞笑结构。Step9判0。,误判
Fqe3uq1_JJw.aac,来个气泡，我是音。,1,0,搞笑/玩梗,非搞笑/玩梗,简短功能描述，无搞笑结构。Step9判0。,误判
lhTgqZrJzwI.aac,你听到这条语音那么恭喜你听到了我这条语音，那么又恭喜你呗，我已经到了。,0,1,非搞笑/玩梗,搞笑/玩梗,Step2第3条：正常开头+荒诞重复反转，形成废话梗，主动制造笑点。,误判
aCb6M-6FbmA.aac,塞提子ficus。,1,0,搞笑/玩梗,非搞笑/玩梗,无意义文本，疑似识别错误，无搞笑意图，判0。,误判
TwfwFBRJ4lw.aac,学歌变声器发语音还在唱歌，我听着语音封不住了。,0,1,非搞笑/玩梗,搞笑/玩梗,出现“封不住了”表达被逗笑，配合具体场景（学歌变声器唱歌），命中Step1。,误判
kjjuffpLjK0.aac,那我们三年级又算什么呢？小妹妹珍惜你的幼儿园和一年级吧。珍惜吧。,0,1,非搞笑/玩梗,搞笑/玩梗,以反问调侃幼儿园/一年级，制造反差笑点，命中Step2第2条。,误判
B12t24L-gKQ.aac,posh me and don't posh me you。what a get my stadesfection。,1,0,搞笑/玩梗,非搞笑/玩梗,无意义英文乱码，疑似ASR错误，判0。,误判
